,Unnamed: 0,articleTitle,articleUrl,publishedDate,sourceName,text
15,15,Food prices drop for first time in 6 years,http://timesofindia.indiatimes.com//city/delhi/Food-prices-drop-for-first-time-in-6-years/articleshow/11380946.cms,2012-01-06,The Times Of India,"NEW DELHI: Food inflation turned negative for the first time in nearly six years in late December as prices of vegetables, potato, onion and some cereals fell sharply, prompting analysts to say the data provided headroom for the Reserve Bank of India (RBI) to cut interest rates and support growth.Data released by the commerce and industry ministry on Thursday showed food inflation, as measured by the wholesale price index, fell by 3.36%  sharply lower than the previous week's 0.42%. It stood at 20.84% in the same year-ago period.Finance minister Pranab Mukherjee said there was substantial improvement in the food inflation situation. ""Food inflation has turned negative for the first time in recent memory,"" he told reporters.Thursday's data showed vegetable prices fell by 50.22% year-on-year while potato prices declined an annual 34.01%. Onion prices which had shot up last year fell by 73.74% year-on-year. Wheat prices declined an annual 3.41%. But price of pulses firmed up an annual 13.85% during the week under review.C Rangarajan, chairman of the Prime Minister's Economic Advisory Council, said he expects the overall inflation to ease below 7% by end-March. Policymakers have been wrong-footed several times in the past two years while predicting the inflation trend.""We have to wait for December inflation figures to see if the non-food manufacturing numbers have also followed the same path. The December numbers will indicate when and how RBI will act,"" he told reporters. ""The environment appears to be in favour of the Reserve Bank reversing its monetary policy stance,"" he said.Soaring food prices for more than one year have hit household budgets and contributed significantly to overall inflation which has hovered around double-digits.Economists said the decline in food inflation was largely due to a statistical base effect but also showed that supplies had improved significantly.""The supplies have been relatively better. We expect December inflation around 7.5% and expect the RBI to first reduce the cash reserve ratio in its January policy and then follow it up with a rate cut over the next two-three months,"" said Samiran Chakraborty, economist at Standard Chartered Bank. Overall inflation in November remained above the 9% mark and data for December is expected next week.Stubborn inflation had forced the RBI to raise interest rates 13 times since last March. It announced a pause in its tightening cycle in the recent policy review. The central bank has said its strategy may now change to supporting growth if there is significant evidence of inflation easing. Analysts and bankers expect the RBI to cut rates soon. The economy is expected to grow around 7.5%, sharply slower than the previous estimate of over 9%.The index for food articles group declined by 0.2% to 190.0 from 190.3 for the previous week due to lower prices of jowar, fruits and vegetables, gram and moong (1% each). But prices of chicken (3%), egg, ragi and maize (2% each) moved up.The data also showed that prices of fruits, milk, egg, meat and fish prices remained stubborn. Protein-based items have remained stubborn due to rising demand and economists say they still remain as pressure points.""The trend of sharp decline in food inflation has increased the probability of interest rate cuts,"" said D K Joshi, chief economist at ratings agency Crisil.The government is exulting in the fact that food inflation has consistently seen a downward swing in recent times. It has now slumped further to settle at -3.36%. Yet the benefits haven't percolated down to the consumers, who are at the receiving end of retail bullying. They are now questioning the significance of an index that fails to reflect ground reality.Food prices in October and November, Delhiites say, were so high that a marginal drop in December made no difference to their lives. Moreover, depending on where they stay and who they buy their vegetables from, Delhiites will be spending differently on the same food.Rama Ghosh, a resident of CR Park, says other than onions and potatoes, all other vegetables either cost the same as they did in November, or there is a very minute difference in their prices. ""I buy vegetables in Govindpuri where the prices have always been lower and the fall in rates has also been sharper,"" she says.Anita Singh of east Delhi claims prices have come down sharply since November. ""I've been buying cauliflower for Rs 20 per kilo,"" she says. But Ruma Roy from Gulmohar Park disagrees. She has been purchasing cauliflower for Rs 30 per kilo, ""a preposterous price for a winter vegetable"".""Wholesale prices in December 2011 were much lower compared to prices in December 2010. Even now, prices are lower than what they were a month ago, but retailers continue to milk consumers for what they are worth,"" says an official of Azadpur mandi.With prices of several commodities having gone up in 2011, including fuel, milk, dairy products and LPG, consumers say that a minor drop in vegetable prices goes almost unnoticed. ""I don't know whether such marginal reduction in prices should be highlighted by the government. In fact, if prices of potatoes and onions have reduced, the prices of other items are going up. People cannot eat only potatoes. Dal specially is very expensive  Chana dal is about Rs 70 per kg. I have five children at home. Do you think we can manage our expenses like this? We often fail to give children the kind of food they want to eat,"" says Saroj Chalia, a resident of Rohini.Many feel that the claims of the government or economists have not translated to any benefit for the consumer. ""These are mere claims. There is hardly any change in prices. Rather, the change is so small that it doesn't matter. I think the pricing of food products also depends on the area. I am a resident of Vasant Kunj in south Delhi. It is very expensive to shop there. Arhar dal, for instance, is Rs 80 per kg. We have to compromise on our purchases as we are not able to buy all kinds of dal,"" says Shefali Mishra, a DU professor.Rajan Sachdev, owner of a grocery store at INA, feels the difference is too marginal to count. "" The change in prices is so slight that the common man doesn't realize. I also feel that the prices of essentials are skyrocketing. If not potatoes and onions, take into account pulses and lentils. Do you think the poor can survive like this?"" he says."
16,16,Food inflation in negative territory,http://www.thehindu.com/todays-paper/tp-business/food-inflation-in-negative-territory/article2779098.ece,2012-01-06,The Hindu,"For the first time in nearly six years, food inflation entered negative territory, plunging to (-) 3.36 during the week ended December 24 from 0.42 per cent in the previous week, mainly owing to a sharp dip in prices of onions, potatoes and other seasonal vegetables.The slump into the negative zone for the first time as per the available WPI (wholesale price index) food inflation data with 2004-05 as the base year appears to have paved the way for a much-awaited cut in key rates by the Reserve Bank of India during its next monetary policy review slated for January 24.High base effectThis is despite the fact that the sharp decline is partly owing to the effect of a high base as food inflation during the like week in 2010 was at a high of 21 per cent. Nevertheless, enthused by the respite from high food prices, Finance Minister Pranab Mukherjee said: There has been substantial improvement. Food inflation has turned negative for the first time in the recent memory.''The figures speak for themselves.As per the official data released here on Thursday, onion prices slumped by 73.74 per cent during the week while potatoes also turned cheaper by 34.01 per cent on a year-on-year basis.Prices of vegetables, on the whole, fell by 50.22 per cent, as did wheat by 3.41 per cent.Compared to prices of edibles during the first week of November when food inflation stood pegged at double digits, the slide in prices has been substantial.Policy stanceCommenting on the WPI data, Prime Minister's Economic Advisory Council (PMEAC) Chairman C. Rangarajan said: The environment appears to be in favour of the RBI reversing its monetary policy stance.Dr. Rangarajan viewed that the decline in food inflation would also help bring down headline inflation  which factors in manufactured items, fuels and non-food primary articles  to below 7 per cent by March this year.Evidently, having hiked interest rates 13 times since March last year, followed by a pause in December, the stage is set for the Reserve Bank of India to cut its key policy rates so as to induce overall consumer demand and spur industrial growth."
17,17,Buddha rates Mamata 0/2  on farmers & industries,http://indianexpress.com/article/cities/kolkata/buddha-rates-mamata-0-2-on-farmers-industries-2/,2012-01-09,Indian Express,"Former Chief Minister Buddhadeb Bhattacharjee on Sunday accused the Mamata Banerjee-led government of impairing development in the state. Criticising the government for failing on both the sectors,agriculture and industries,he said: The government has taken the state backward in both industry and agriculture  It has not taken a single step towards industrialisation compared to what was done by us. No new industry has come up under the new regime, said the CPM leader while addressing a party rally here.He claimed that industries like JSW steel,Wipro,Infosys and Cognizant had set foot in the state during the Left Front rule,but now investors are realising that this government will not do anything to bring new industry.Bhattacharjee said that although there had been a good harvest of aman paddy this season,the cultivators could not sell the produce because neither the government nor the cooperatives were buying the crops.I recently went to Burdwan. There,the paddy growers are running from pillar to post trying to sell their harvest. Even if they can,they are getting Rs 600 to 700 per quintal,instead of the MSP of Rs 1,100, Bhattacharjee said.He said farmers are also reluctant to go for potato and boro cultivation for fear that they would not be able to sell their produce.Although the erstwhile Left Front government had taken steps to buy jute at Rs 4,000 per quintal,the price now stands at Rs 2,000. Why is this? No one seems to know and no one is doing anything. Ministers are giving differing statements. This has never happened when we were in the government, Bhattacharjee said.On the recent incidents of violence in some colleges in the state,Bhattacharjee alleged that law and order is on the brink of a breakdown under the present government.The CPM leader also found fault with the signing of the Gorkhaland Territorial Administration (GTA) agreement in Darjeeling,initiated by the Mamata Banerjee government,saying it would only boost the demand for Gorkhaland and not bring development of any sort.There is no reason to think that agitators would abandon the demand for Gorkhaland with the signing of the GTA agreement. It will only foment the demand. Darjeeling is sitting on a powder keg. It will erupt any day, he said.For all the latest India News, download Indian Express App now"
19,19,Food inflation remains in negative zone,http://timesofindia.indiatimes.com//business/india-business/Food-inflation-remains-in-negative-zone/articleshow/11467594.cms,2012-01-13,The Times Of India,"NEW DELHI: A substantial fall in prices of vegetables, including that of potatoes and onions, led to food inflation slipping to minus 2.90% on December 31  the second week in a row that it has remained in the negative zone.A happy finance minister Pranab Mukherjee said, ""Food inflation is still negative... There is a declining trend, headline inflation should be 6-7% by end March."" The data showing drop in prices of food articles of common man was released on Thursday, less than two weeks before the Reserve Bank of India (RBI) is set to review its monetary policy, amid expectations of a cut in interest rates.Food inflation, measured by the wholesale price index (WPI), was over 19% in the corresponding week in the previous year.It was minus 3.36% in the preceding week ended December 24,2011."
22,22,"Infy flat forecast trips IT stocks, spooks markets",http://timesofindia.indiatimes.com//city/bangalore/Infy-flat-forecast-trips-IT-stocks-spooks-markets/articleshow/11469990.cms,2012-01-13,The Times Of India,"BANGALORE: Infosys' stunning declaration that this quarter its revenues will not grow in dollar terms from the $1806-million recorded in Q3 spooked the markets, causing the scrip to dip 8.43% and dragging other tech stocks down.Again, it raised the question whether Thursday morning's ""negative surprise"" was a sectoral issue or a company-specific one, with many veering towards the latter perspective.It's being speculated that Infosys might be having a problem with a key account, and that its largest account (in the banking and financial services space) has, perhaps , de-grown by about 7%.The ""flattish guidance surprise"" overshadowed an otherwise good Q3 performance by Infosys where its dollar revenues grew 14% over the previous year and 3.4% over the previous quarter . Net profit at $458 million was up 15.4% for the year, and 11.4% over Q2. The biggest surprise was the 3-percentage-point rise in operating margins to 31.7%.While the continuing economic crisis in the US and Europe - from where Infosys gets 86% of its revenues - is definitely a factor, the weak Q4 guidance comes on the heels of the company struggling in recent quarters with its earnings.SD Shibulal, the new CEO of the company, attributed the flat Q4 revenue projection to ""the lack of velocity in the business,"" insisting it's a ""reflection of the market situation"" .Food inflation remains in negative zoneNew Delhi: A substantial fall in prices of vegetables, including that of potatoes and onions, led to food inflation slipping to minus 2.90% on December 31 - the second week in a row that it has remained in the negative zone.A happy finance minister Pranab Mukherjee said, ""Food inflation is still negative... There is a declining trend, headline inflation should be 6-7 % by end March."" The data showing drop in prices of food articles of common man was released on Thursday, less than two weeks before the Reserve Bank of India is set to review its monetary policy , amid expectations of a cut in interest rates.Food inflation, measured by the wholesale price index (WPI), was over 19% in the corresponding week in the previous year.It was minus 3.36% in the preceding week ended December 24,2011.The maximum drop in prices was witnessed in onion which became cheaper by 74.77% year-on-year during the week under review, while potato was down 31.97%. Overall, vegetables became 49.03% cheaper while wheat also fell by 3.35 %."
23,23,Food inflation remains in negative territory,http://www.thehindu.com/todays-paper/tp-business/food-inflation-remains-in-negative-territory/article2797188.ece,2012-01-13,The Hindu,"Food inflation continued to remain in negative territory at minus 2.9 per cent for the week ended December 31 owing to a significant fall in the prices of vegetables, particularly onions and potatoes.Though at a slightly higher level as compared to the (-)3.36 per cent logged in the previous week in December, this is the second successive week that the WPI (wholesale price index) based food inflation has remained in the negative zone. Apart from a marked fall in prices of edibles, this has been partly owing to the effect of a high base as food inflation in the like week a year ago was at over 19 per cent. The heartening WPI data has raised cautious hopes of a cut in interest rates while an enthused Finance Minister Pranab Mukherjee is looking forward to a decline in headline inflation by the end of the fiscal. Food inflation is still negative ...There is a declining trend  If this trend continues, then the overall inflation with be manageable. Headline inflation should be 6-7 per cent by end-March, he said.While the overall prices of vegetables dipped by over 49 per cent year-on-year, the steepest decline was witnessed in the prices of onions by 74.77 per cent and potatoes by 31.97 per cent. Wheat prices also fell by 3.35 per cent. Alongside, protein-rich items continued to cost more. However, pulses remained dearer by 14.72 per cent, as was milk by 10.79 per cent and eggs, meat and fish by 5.22 per cent."
26,26,Inflation skids to 2-year low,http://www.deccanherald.com/content/219608/inflation-skids-2-year-low.html,2012-01-16,Deccan Herald,"New Delhi, Jan 16, DHNS: 22:26 ISTCrashing food prices see the index dip to 7.47 per centCrashing food prices in recent weeks helped Indias headline inflation ease to a two-year low of 7.47 per cent in December, but only a marginal decline in manufactured inflation left the government and policymakers worried and may also hold the central bank from lowering interest rates in this months policy review.Reacting to the lowered inflation number, Finance Minister Pranab Mukherjee expressed hope that WPI inflation would come down to 6-7 per cent by March end, but said only a marginal decline in manufacturing inflation was still a cause of concern.The manufactured inflation and inflation in the power group of items have also declined though only marginally, therefore, continued to be a cause of concern, Mukherjee said. The WPI inflation came down sharply in December, easing from 9.11 per cent in the previous month on the back of cheaper onion, potato and wheat prices during December.Official data showed vegetables were cheaper by 34.18 per cent and wheat by 3.81 per cent on an annual basis. Potato and onion prices also fell by 35.45 per cent and 60.45 per cent year-on-year during December.Prices of food items eased to 0.74 per in December from 8.54 per cent in the previous month. The Manufacturing index, however, went up since November. Manufacturing inflation was at 7.41 per cent compared with 7.7 per cent in the previous month.Inflation in the fuel and power segment stood at 14.91 per cent on an annual basis in December, as against 15.48 per cent in the previous month.The depreciation in the rupee vis-a-vis dollar has sharply pushed up fuel inflation as India imports nearly 80 per cent of its crude requirements for which it has to pay in dollars.Analysts said, core inflation, which excludes food and fuel prices, still remained close to 8 per cent suggesting the Reserve Bank of India may not go in for a reversal in interest rate cycle as early as this month.Although the Central bank left its key lending rate unchanged at its December policy review, it has risen it 13 times since March 2010 lifting repo rate by 375 basis points and reverse repo by 425 bps. The bank will next meet no January 24 to review monetary policy.Inflation in overall primary articles stood at 3.07 per cent in December, compared to 8.53 per cent in November."
27,27,"Relief on prices: At 7.47%, inflation at 2-yr low",http://timesofindia.indiatimes.com//business/india-business/Relief-on-prices-At-747-inflation-at-2-yr-low/articleshow/11518226.cms,2012-01-17,The Times Of India,"NEW DELHI: Inflation slowed to a two-year-low in December on the back of a sharp decline in food inflation, providing enough headroom for the Reserve Bank of India to start easing tight monetary policy in the months ahead.But economists said the RBI may start the process of cutting interest rates only after the Union Budget which is likely to be presented to Parliament in mid-March.Data released by the commerce and industry ministry on Monday showed the annual rate of inflation, as measured by wholesale price index, stood at 7.47% in December compared to 9.11% in November and 9.45% during the corresponding month of the previous year. This was the lowest reading since December 2009 when it stood at 7.15%.The sharp moderation in inflation comes as a huge relief for policymakers who have been battling stubborn price pressures since 2010. Inflation has remained above 9% for a significant period piling pressure on the government and upsetting household budgets.Finance minister Pranab Mukherjee said he was confident that the easing trend would be sustained in the months ahead. He reiterated that the headline inflation should be between 6% and 7% by March-end. Mukherjee said the recent inflation and industrial output data indicated some improvement in the overall macro-economic situation and hinted at policy correctives to consolidate the trend.But Mukherjee said the manufactured inflation and inflation in the power group of items continued to be a cause of concern. The index for the manufactured products group rose by 0.6% to 140.6 from 139.8 for the previous month.Data showed the index for food articles group declined by 3.1% to 190.8 from 196.9 for the previous month due to lower prices of fruits and vegetables (13%), condiments and spices (6%), urad (5%), chicken (3%), tea (2%) and jowar, rice, arhar, ragi and barley (1% each). But prices of pork (8%), river fish (5%), maize (3%), bajra, egg, beef and buffalo meat, mutton and masur (2% each) and gram, coffee, wheat and milk (1% each) moved up.Vegetable prices declined an annual 34.81% while onion prices dropped 60.45% year-on-year. Potato prices declined 35.45% year-on-year. Milk, eggs, meat and fish and pulses prices remained robust.Economists said the RBI would prefer to wait and watch to see how the price situation unfolds in the weeks ahead and then take a call on cutting interest rates.""There was never a strong case for a rate cut at the upcoming January 24 policy review, in our view. We maintain our view that the RBI will likely cut rates after the federal budget (mid-March),"" said Rajeev Malik, senior economist at CLSA in Singapore.""However, a cut in the cash reserve ratio (CRR) should not be totally ruled out because of the need for a sustainable solution to address the excessively tight money market liquidity situation,"" Malik said. The RBI will review monetary policy on January 24."
30,30,Food inflation in negative zone for 3rd consecutive week,http://timesofindia.indiatimes.com//business/india-business/Food-inflation-in-negative-zone-for-3rd-consecutive-week/articleshow/11551304.cms,2012-01-19,The Times Of India,"NEW DELHI: Food inflation remained in the negative zone for the third straight week, at minus 0.42 per cent for the week ended January 7, 2012 mainly due to fall in prices of onion and vegetables.Food inflation, as measured by the Wholesale Price Index (WPI), was at minus 2.90 per cent in the previous week. It was above 16 per cent in the corresponding week of 2011.According to the official data released on Thursday, onion prices were lower steeply by 75.42 per cent year-on-year during the week under review, while potato prices were down by 23.84 per cent. Prices of wheat also fell by 3.57 per cent.Overall, vegetables were 45.81 per cent cheaper during the week under review than in the same period last year.Other food products, led by protein-based items, became more expensive on an annual basis.Pulses prices were 14.27 per cent higher during the week under review, while milk grew dearer by 11.48 per cent. Egg, meat and fish prices were up 19.64 per cent year-on-year.Fruits also became 10.03 per cent more expensive on an annual basis, while cereal prices were up 2.26 per cent.Inflation in the overall primary articles category stood at 2.47 per cent during the week ended January 7, 2012 against 0.51 per cent in the previous week. Primary articles have over 20 per cent weight in the wholesale price index.Experts feel that the decline in food inflation, along with moderation in headline inflation during December 2011, will be a major incentive for the Reserve Bank to look at the option of cuts in key interest rates in the near future."
