,Unnamed: 0,articleTitle,articleUrl,publishedDate,sourceName,text
290,290,Potato farmers in lurch as supply chain sputters,http://timesofindia.indiatimes.com//city/kolkata/Potato-farmers-in-lurch-as-supply-chain-sputters/articleshow/55613775.cms,2016-11-25,The Times Of India,"KOLKATA: Potato prices continued to remain the same in city marts but there has been a slight dip on the fringes.Cold storage owners have started clearing old stocks because the liquidity crunch has robbed of the buoyancy in the retail market. At the farm level, however, there is a crisis of capital that continues to bother tuber growers even after the Centre's assurance of giving fresh loans to farmers for the sowing and harvesting season. Potato may pinch pockets in the coming season as there has been a drop in its acreage.Tarakeswar Aloo Byabsayee Samity secretary Swapan yee Samity secretary Swapan Samanta put it straight. ""I have come to know that 359 Krishi Samabay Samitis in the Hooghly district will get Rs 50,000 each. If this works out, the total amount adds up to around Rs 2 crore. The outgo as loans during the last season was Rs 212 crore. The KSUs can't disburse the paltry loan amount on their own.They have to give names and address of the farmers and send the list to the central cooperative bank in the district.The bank won't sanction lo ans to those who have taken loans earlier,"" Samanta said.A back-of-the-envelope calculation gives a feel of the calculation gives a feel of the ground reality . ""Potato cultivation for a bigha costs a farmer an average Rs 20,000. I have five bighas and I need Rs 1 lakh for the farming. But the KSU has a total kitty of Rs 50,000. It can meet only a small fraction of the demand.Farmers can't wait. Some have bought seeds and the minimum fertiliser on credit making a payment assurance of Rs 50-100 more after the yield.Some have left parts of their land empty . The result is for all to guess,"" Samanta said.While Hooghly farmers have got a hint of the Centre's loan disbursement, Burdwan district magistrate Soumitra Mohan hasn't got any such communication. ""I am not aware of any such communication to the central cooperative bank till date,"" the DM said. Bankura district officials also sounded non-committal.This has left the potato growers in vast stretches of Joypur, Simplipal and other parts of Jangalmahal in the lurch."
298,298,"Food prices steady, but is there a secret behind that?",http://www.newindianexpress.com/nation/2016/nov/28/food-prices-steady-but-is-there-a-secret-behind-that-1543360.html,2016-11-28,The New Indian Express,"More than two weeks after confiscatory demonetisation sucked cash out from the economy, the food market has remained by and large steady, rather deceptively so. This held true at small retailers and vegetable shops in the cities and towns that Express checked out.There are small differences, but all marginal. The perishable commodities  tomato was a common casualty  did witness a downturn, but mostly due to stock clearance sale in the evenings. But the figures may not tell the full story. This is not stability, insist traders, who have been having few visitors and minimal sales. The fall in demand starts at 40-50 per cent and climbs higher for hawkers. Its this decline in demand that is keeping the price steady, a perilous equilibrium.Veterans in the trade who have learnt to look beyond the immediate told Express that the situation could change if cash does not return to the market in the next few weeks and if stocks dry up. What the low demand conceals are stories about farm produce that could not be brought to the market due to supply chain disruption following the cash crunch. In some cases, harvests have been postponed as the price offered is less than what is required to pay the farm hands.Every acre that is not cultivated and every tonne of produce not reaching the market will add up to a sharp decline in supply in the coming months, the period when markets are hoping to stabilise with the expected arrival of currency. If the fears prove to be true, a price inflation may be around the corner.Express does a status check across South India and Odisha on the impact of demonetisation on prices and sales of small retailers and vegetable and fruit shops.KOCHIWhat when the stocks are over?Shibu B STwo weeks into demonetisation of big currency notes, markets have been able to maintain steady prices. Being a consumer state, Kerala depends upon other states for most of the essential commodities. Usually, wholesale dealers stock up goods by October-end, ahead of the Christmas season, explained Ernakulam Broadway Shop Owners Association (BSOA) joint secretary Joseph DSilva. But traders expect prices to go up in the coming month on the basis of the cash flow and arrival of stocks from other states.However, there is a dip in demand. For instance, a retailer who used to buy 500 kg of onion before demonetisation is now buying only half of that quantity, DSilva added. Another reason for the steady prices is that a major chunk of the transactions between wholesale dealers and retailers in Kerala is being done through credit. The major crops produced here like coconut and pineapple and pepper have suffered a drop in its prices, said P Solomon of Pushpa Stores, Ernakulam Broadway.VIJAYAWADASales down to 20 per centS Guru SrikanthMarkets in Vijayawada have gone into a freeze since the demonetisation of Rs 1,000 and Rs 500 currency notes. Merchant associations say business is not even 20 per cent what it used to be at this time of the year. However, there has not been much of an impact on prices of essential commodities. Only volumes have come down. With no money in the market, outstanding payments, outstanding receipts and loans have been affected. The situation has impacted sales, particularly of perishable commodities, said Vakkalagadda Bhaskar Rao, president of Vijayawada Chambers of Commerce and Industry.In the first week after Prime Ministers announcement, prices of vegetables fell by 10-20 per cent in the wholesale market, but rose slightly in the second week. On November 25, they were back to the same level as on November 8. Normally, prices surge when demand is high and/or supply is less. But with demand and supply plummeting, prices have been stable. Simply put, the market has come to a near standstill.BHUBANESWARRise in prices plus drop in salesHemant Kumar RoutUnlike in the southern states, the currency crisis has resulted in a rise in prices of some essential commodities in Bhubaneswar as well as a drop in sales.Prices of pulses and spices have increased by at least 10 per cent and that of wheat and flour by 20-25 per cent. However, there was no significant change in the prices of rice, potatoes, onions, milk, edible oils and poultry products.In consonance with other states, Bhubaneswar markets have witnessed a reduction in prices of fruits and vegetables by 10-15 per cent and 20 per cent, respectively.The arrival of winter produce along with lack of consumer demand is helping to keep vegetables prices low. Some vegetables are now available at 30-50 per cent less.Sudhakar Panda, general secretary of Federation of All Odisha Traders Associations, said the rise in prices of pulses, wheat and spices is due to supply chain kinks  mainly transportation problems  that have arisen due to demonetisation.HYDERABADConsumers tight-fistedJ Deepthi Nandan ReddyBarring a few exceptions, demonetisation has left prices of essential commodities untouched, but prices of perishable goods such as vegetables, fruits have decreased considerably. Vegetables such as tomatoes were in fact dumped in the Hyderabad markets last week as there were few takers. Consumers have either not been able to access small notes of valid currency or having gained access to such notes have been reluctant to part with them.This tight hold on cash has badly affected vegetable and meat sales and prices. For instance, tomatoes sold at Rs 20 per kg before demonetisation are now available for Rs 10. Prices of other vegetables have also dropped as sellers lowered prices to dispose of produce. Buyers have become scarce, said Mohammed Ibrahim, a vegetable vendor at Mehdipatnam in Hyderabad. Further, due to rumours and apprehensions of transport being affected post-demonetisation, the price of salt touched Rs 60 immediately after November 8. However, the situation soon returned to normal.BENGALURUDIp in prices of perishablesAkram MohammedPrices of essential commodities like rice and pulses have not seen much difference in Bengaluru post demonetisation, but prices of perishable commodities like fruits and vegetables are down by 20-30 per cent, according to Bangalore Wholesale Foodgrains and Pulses Merchant Association. Prices of pulses have been more or less stable but volumes are low. There are three issues here. First, sales have come down. Second, perishables are being sold at lower prices since they cannot be stored for a long time. Third, small vendors have been hit really hard.A vegetable trader Kamraj K said he procures two small truckloads of vegetables every day. However, in the last five days, he has cut it to one. Sales are down by 70 per cent across all foods. Bharath Shah, chairman of the food processing and internal trade cell of the Federation of Karnataka Chambers of Commerce and Industry, said, I fear this situation will continue for another six months if we dont bring money back into the market.CHENNAISmaller traders take the hitSushmitha RamakrishnanThe severe shortage in cash has prompted people to tighten their purse strings, bringing less money in the commodity market in Chennai. There is much less supply, as small traders have refrained from buying the usual quantum in a sluggish market. But there is no resultant increase in price due to the lack of demand.The shops in Chennai that Express visited said their sales have been down by half in the aftermath of the demonetisation drive. But that has not had an impact on prices.Even in cases like potatoes where the price is supposed to have an upward revision around this time has not happened.In this currency-driven business, they have no money to procure supplies due to restriction on cash withdrawal. In that, the smaller traders are at a severe disadvantage vis-a-vis the retail chains which have the network to ensure interrupted supply.Thus, while the smaller ones are seeing a fall of 50 per cent and more in sales, the networked shops have had a beneficial time."
301,301,"BKU to give away free potatoes, paddy",http://timesofindia.indiatimes.com//city/lucknow/BKU-to-give-away-free-potatoes-paddy/articleshow/55697640.cms,2016-11-30,The Times Of India,"LUCKNOW: The Bharatiya Kisan Union (BKU) will distribute free of cost potatoes and paddy as a mark of protest against the Centre's apathy towards the country's farm sector. The distribution drive, planned outside the UP Legislative Assembly building, is aimed at drawing the government's attention to the acute problems being faced by farmers across the country, exacerbated by the government demonetisation move which had led to a liquidity crunch.Speaking to TOI, BKU's Lucknow spokesperson Alok Verma said, ""Farmers have not been able to sell their potato and paddy produce and the markets are lying empty . To make ends meet, a large number of them were forced to make distress sale of paddy at Rs 600 to Rs 800 per quintal even though the minimum support price declared by the government is Rs 1,470 per quintal. Now, demonetisation had crippled business further because farmers have no money to buy seeds, DAP , and fertilisers to sow the rabi (winter) crop. They are dumping their produce in the state capital in the hope that the government will take note and do something for them.""Until Tuesday night, 22 trucks-full of paddy and potaoes had landed up outside the BKU office in Lucknow. Verma claimed that potatoes and paddy in excess of 100 quintals will be up for grabs outside Vidhan Sabha. ""Our distress is not a joke.Farmers have given their sweat and blood for this produce and they are getting no buyers. We have to feed our families too.And the government is turning a blind eye to the country's ""annadaata"","" Verma added."
308,308,Vegetable prices down to half,http://timesofindia.indiatimes.com//city/nashik/Vegetable-prices-down-to-half/articleshow/55759945.cms,2016-12-03,The Times Of India,"Vegetable prices in city's retail markets have declined up to 50% after demonetisation of high-value currency notes on November 8.Prices of all vegetable, except onions, have declined in the range of 25% to 50% in the past 23 days. Prices of tomato, chilli, cauliflower and cabbage have declined by 50%, while potato prices have declined by 40% ""Retail prices of vegetables have declined in the range from 25 to 50% after demonetisation. Lack of currency notes or change is the major reason for the fall in prices. The consumer, who would earlier buy vegetables for Rs 200 per week, is now buying vegetables for Rs 100 per week,"" said Sachin Barke , a vegetable vendor. ""Moreover, there had been rise in arrival of vegetables in the market. All this led to decline in prices.""Uttam Avhad, a farmer from Sinnar said, ""The wholesale prices of vegetables have declined after demonetisation. Today, I bought 15 quintals (1,500kg) of cabbages at the rate of Rs 100 a quintal or Re 1 a kg during auction. Hence, I did not sell my produce to traders. I started selling the cabbage directly to retailers at Rs 3 kg. I sold almost all the stock but I had to stand up throughout the day... Some people bought two to three kg as they were cheaper than that in the retail market.""""I came here after a fortnight to buy vegetables. I purchased a stock for almost a week. Prices were cheaper comparatively,"" said Ankit ShuklaTomatoes, which were sold at Rs 20 a kg on November 7, declined to 10 a kg on December 2 due to decline in demand as compared to supply. Chilli prices declined from Rs 30 a kg to Rs 15 a kg. The prices of cauliflower and cabbage also declined from Rs 20 a kg to Rs 10 a kg each after demonetisation.While prices of most of the vegetables declined up to 50%, it was only onion that was little costlier . In the retail market, onion prices have increased from Rs 10 a kg to Rs 15 a kg after demonetisation."
324,324,Potato prices drop as cold storages clear stock,http://timesofindia.indiatimes.com//city/ahmedabad/Potato-prices-drop-as-cold-storages-clear-stock/articleshow/55930204.cms,2016-12-12,The Times Of India,"AHMEDABAD: Expectation of a bumper potato crop this year has made cold storage owners begin clearing their stock with zeal resulting in a steep drop in wholesale prices of potatoes. Potatoes, which according to quality were fetching wholesale prices between Rs4 and Rs11 per kg, just a week ago, are now being sold at Rs1.5-Rs6 per kg. In the retail market, prices of potatoes have climbed down from Rs18-Rs22 per kg to Rs11-Rs15 per kg.Deepak Patel, secretary, APMC, Ahmedabad, said, ""Last year at this time, potato prices were at Rs8 to Rs10 per kg, but this year it has dropped to Rs1.5 per kg. The potatoes we are getting now are local potatoes, which are from cold storage.""Speaking on the price drop of potatoes, Kishorekumar Lachhmandas Paryani, a trader in APMC, Ahmedabd, said, ""The old stock is being released from cold storages thus leading to the drop in prices."" Paryani said last year's crop was bountiful and thus the amount of potatoes stocked in cold storages was higher than usual.""Old stock will continue to be released for another month until the new potato crop starts arriving,"" said Paryani.Retailers, however, are of the opinion that there will be no further price drop, and that prices have stabilized.Richa shah a homemaker from Satellite said, ""I don't know whether potato prices will remain low in the coming days, and so I have decided to make and store potato wafers, which I usually do on arrival of the new crop."" She was happy that prices of most vegetables have dropped.Farmers in the state had received good prices for their crops in April 2016 despite 15% increase in production. As compared to Rs5-Rs6 per kg they received for potatoes in April 2015, in 2016, the new crop had fetched them around Rs10 per kg in the wholesale markets.Gujarat has over 420 cold storages located mainly in Banaskantha, Sabarkantha and Kheda. Potatoes from Gujarat are supplied to Maharashtra and states in South India. They are also exported to Sri Lanka, Vietnam and Mauritius."
337,337,Potato prices hit rock bottom despite increase in demand,http://timesofindia.indiatimes.com//city/indore/potato-prices-hit-rock-bottom-despite-increase-in-demand/articleshow/56029427.cms,2016-12-17,The Times Of India,"INDORE: Potatoes cultivated in Malwa region of the state are gaining popularity in Gulf countries. Export of potatoes used for making snacks has increased in the last few years and will grow further with rising demand, experts at the International exhibition of cold chain expo said on Friday.The claims about good prospects for potatoes came at a time when a strong protest was held here by farmers who claim that potato prices have come down to Re 1 per kg. Manohar Shardiya, managing director of a cold storage said, ""With a rise in the snacks industry, demand for potato is growing rapidly in the state. Malwa potatoes are preferred for exports because of its high quality and taste. Top quality potatoes are exported while average and inferior ones are sent to local markets for consumption.""According to data from the agriculture department, farmers have sown vegetables that include potato and garlic on 30,000 hectares in the region this rabi season as against the target of 22,000 hectares.With disposable income in the country on the rise, the snacks industry is growing at a rate of over 10 per cent per annum according to experts.""Rapid growth of the snacks industry is boasting of a high demand for potatoes. The need for cold storages has also gone up so that produce can be stored longer and quality can be maintained,"" Shardiya said.With the upgrading of technology and rising production, the trend for multi-commodity cold storage chambers is rising in the country. Of 65 cold storages in Indore district, 40 are multi-commodity cold units.There are 210 cold storages in Madhya Pradesh Hansmukh Jain Gandhi, president, MP cold chain Industries Association said, ""The state has great potential to become a hub for cold storages due to its demographic advantage and high production of fruits and vegetables. Production of potatoes, cabbage, carrots and fruit such as oranges have grown in the past few years.""However, experts said that the state should improve its technology and farmers should get connected with the market for better opportunities. Pawanexh Kohli, CEO and chief advisor, National Centre for Cold chain Development said the state has the potential to build more cold storages but the selling radius for farmers should be expanded so that they can connect with their own choice of markets."
345,345,Distress sale by potato hoarders as stocks arrive,http://timesofindia.indiatimes.com//city/kolkata/Distress-sale-by-potato-hoarders-as-stocks-arrive/articleshow/56092500.cms,2016-12-21,The Times Of India,"KOLKATA: A section of potato farmers , who hoarded the crop in cold storage till the last moment to reap a windfall, is now resorting to distress sale of their stock. Liquidity crunch and fresh supply of potato from Uttar Pradesh and Punjab have changed the game altogether. The wholesale price of Jyoti variety of potato crashed to Rs 2-3 per kg at markets closed to cold storages across Bengal. However, the crash has a little impact on the retail markets in the city.This year saw the least potato production  9 million tonne  in Bengal compared to earlier years. So, many farmers and middlemen calculated a good price if they managed to hoard a substantial amount of potato. A section of farmers, middlemen and cold-storage owners fudged this year's actual storage to jack up the price. So, when the actual storage was 6.5 million tonnes across 462 potato cold storages in Bengal, it was shown only 3 million tonne. This led to abnormal rise of potato price in both wholesale and retail markets.Potato economy of Bengal is always erratic. It is one of the most risky farming bets. With a contribution of 25% in India's potato output, Bengal is the second-largest producer of the vegetable after UP. ""A section of middlemen and traders speculate the probable price of potato every year, keeping in mind the production of potato and its price in previous years. But things often go haywire when ground reality changes,"" said Shankar Adhikari , an agriculture economist.November 30 was the last date for clearing entire stock. But government found a huge stockpile of potato in the cold storages. Agriculture marketing minister Tapan Dasgupta extended the last date of clearing the stock till December 8. But even after that the government found a huge stock uncleared. Now that section of farmers and middlemen find it difficult to withdraw the stock from cold storages as the cost overshoots the wholesale price.Paschimbanga Potato Traders Association president Swapan Samanta said: ""Liquidity crunch along with fresh supply of low-cost potato from Punjab has changed the game. Bengal potato now has hardly any buyer. The potato retail price now should be below Rs 8 in Kolkata's retail markets."" Traders are jostling to sell before the new crop arrives in December end, failing which the old one must be destroyed."
362,362,Demonetisation leaves farmers high and dry,http://www.thehindu.com/todays-paper/tp-national/tp-karnataka/Demonetisation-leaves-farmers-high-and-dry/article16961735.ece,2016-12-30,The Hindu,"In Hassan district, many farmers have kept their stocks of potato, maize, ginger, and other crops as there are no buyers. Seen here are farmers at the agro produces market in Mosale Hosahalli of Hassan taluk. PHOTO: PRAKASH HASSANWhile urban areas in the State are adapting themselves to the changed scenario after the demonetisation of high-value notes, rural areas, especially farmers, continue to be under duress even 50 days after demonetisation.With no improvement in cash flow in villages, there are no takers for farmers produce.The fall in demand has triggered a drop in prices of agricultural produce.In Hassan district, many farmers have kept their stocks of potato, maize, ginger, and other crops as there are no buyers.As those who harvested potato in September/October got Rs. 16 a kg, the farmers who were harvesting the produce in November/December were hoping for a further increase in prices. But, much to their dismay, prices have crashed to Rs. 10 a kg.In this situation, many have not sold their produce. Three truckloads of potato have remained unsold in our village, said Papaiah, a farmer from Marenahalli near Mosale Hosahalli in Hassan taluk. But the stock has started to perish forcing some of them to sell at Rs. 4 a kg. The case of maize growers is no different. The price of maize has dropped to Rs. 1,300-1,400 a quintal from the level of Rs. 1,600-1,700 before demonetisation. Also, farmers have to bear transportation cost as traders have stopped farm-gate purchases after demonetisation in most of the areas.The coffee growers are also hit as demonetisation has coincided with the harvest season. A coffee planter with 25 acres of plantation needs to pay wages of about Rs. 45,000 a week as he hires about 25 labourers. But, one can only withdraw a maximum of Rs. 24,000 a week from the banks, say planters.U.M. Thirthamallesh, secretary of the Karnataka Coffee Growers Federation, says, Because of the cash crisis, planters are hiring less number of workers this year, resulting in delayed picking, which may affect the quality of coffee beans, besides harming the plants in the long run. In northern districts like Kalaburagi, farm labourers have started demanding a part of the harvested produce as their wages instead of accepting money, as several landlords are trying to give them old currency notes.What has added to the woes of farmers is that most of the ATMs in rural areas have remained closed due to paucity of cash."
